number,value,datetime_start,datetime_complete,duration,params_energy_T,params_energy_threshold,params_mc_cycles,params_mc_threshold,params_method,params_model_name,params_temp_T,params_temp_threshold,state
0,0.45948580511961257,2026-06-15 23:07:35.109203,2026-06-15 23:07:35.172902,0 days 00:00:00.063699,,,7.0,0.6594172798200845,MCDropout,normal,,,COMPLETE
1,0.0,2026-06-15 23:07:35.173443,2026-06-15 23:07:35.178120,0 days 00:00:00.004677,,,,,Temperature,normal,3.1559650779355426,0.8259369212951126,COMPLETE
2,0.0,2026-06-15 23:07:35.178629,2026-06-15 23:07:35.186251,0 days 00:00:00.007622,,,,,Temperature,CRF,9.237617402324247,0.8614268276085824,COMPLETE
3,0.5836802318438379,2026-06-15 23:07:35.189300,2026-06-15 23:07:35.330141,0 days 00:00:00.140841,,,16.0,0.8449342089342331,MCDropout,normal,,,COMPLETE
4,0.5982812961025723,2026-06-15 23:07:35.330662,2026-06-15 23:07:35.372692,0 days 00:00:00.042030,5.958522128212702,-7.056200607727895,,,Energy,Mix,,,COMPLETE
5,0.0,2026-06-15 23:07:35.373208,2026-06-15 23:07:35.380912,0 days 00:00:00.007704,,,,,Temperature,CRF,3.8596662617489064,0.9666956211204737,COMPLETE
6,0.0,2026-06-15 23:07:35.381393,2026-06-15 23:07:35.391035,0 days 00:00:00.009642,0.5250977664469245,-13.833919465346806,,,Energy,CRF,,,COMPLETE
7,0.0,2026-06-15 23:07:35.391504,2026-06-15 23:07:35.397530,0 days 00:00:00.006026,,,,,Temperature,normal,9.927801982049992,0.86983545791489,COMPLETE
8,0.704767501741445,2026-06-15 23:07:35.398032,2026-06-15 23:07:35.414671,0 days 00:00:00.016639,5.110670683764314,-4.490491657113727,,,Energy,CRF,,,COMPLETE
9,0.7098456341435411,2026-06-15 23:07:35.415152,2026-06-15 23:07:35.461968,0 days 00:00:00.046816,,,,,Temperature,Mix,0.8756750350590988,0.8373714969349855,COMPLETE
10,0.6199637889201699,2026-06-15 23:07:35.462449,2026-06-15 23:07:35.504963,0 days 00:00:00.042514,,,,,Temperature,Mix,0.6471539029274327,0.5564961075061312,COMPLETE
11,0.5982812961025723,2026-06-15 23:07:35.505567,2026-06-15 23:07:35.559946,0 days 00:00:00.054379,9.792996982203661,4.5954176510634035,,,Energy,Mix,,,COMPLETE
12,0.5982812961025723,2026-06-15 23:07:35.560520,2026-06-15 23:07:35.605504,0 days 00:00:00.044984,2.927982582576548,2.597938381073506,,,Energy,Mix,,,COMPLETE
13,0.0,2026-06-15 23:07:35.605990,2026-06-15 23:07:35.618064,0 days 00:00:00.012074,6.701735749594544,-17.45459333996985,,,Energy,CRF,,,COMPLETE
14,0.6456022031783448,2026-06-15 23:07:35.618652,2026-06-15 23:07:35.920360,0 days 00:00:00.301708,,,30.0,0.5235770177482755,MCDropout,Mix,,,COMPLETE
15,0.0,2026-06-15 23:07:35.920860,2026-06-15 23:07:35.929331,0 days 00:00:00.008471,,,,,Temperature,CRF,6.209823077009594,0.6111561097967626,COMPLETE
16,0.5982812961025723,2026-06-15 23:07:35.929748,2026-06-15 23:07:35.973593,0 days 00:00:00.043845,4.640207325150914,-5.272782692610357,,,Energy,Mix,,,COMPLETE
17,0.704767501741445,2026-06-15 23:07:35.974126,2026-06-15 23:07:35.989465,0 days 00:00:00.015339,9.885695603979848,-4.689696328172126,,,Energy,CRF,,,COMPLETE
18,0.601644964973389,2026-06-15 23:07:35.990354,2026-06-15 23:07:36.045722,0 days 00:00:00.055368,,,,,Temperature,Mix,0.11180741364404256,0.7021584247866403,COMPLETE
19,0.0,2026-06-15 23:07:36.046235,2026-06-15 23:07:36.263031,0 days 00:00:00.216796,,,28.0,0.9275576635188691,MCDropout,CRF,,,COMPLETE
20,0.0,2026-06-15 23:07:36.263560,2026-06-15 23:07:36.300087,0 days 00:00:00.036527,,,,,Temperature,Mix,6.602688393226492,0.7242112528926705,COMPLETE
21,0.704767501741445,2026-06-15 23:07:36.300690,2026-06-15 23:07:36.316161,0 days 00:00:00.015471,9.144336560038763,-4.488904026100593,,,Energy,CRF,,,COMPLETE
22,0.704767501741445,2026-06-15 23:07:36.316636,2026-06-15 23:07:36.331782,0 days 00:00:00.015146,7.952689661624447,-2.180664146593018,,,Energy,CRF,,,COMPLETE
23,0.0,2026-06-15 23:07:36.332250,2026-06-15 23:07:36.345389,0 days 00:00:00.013139,3.589400186436224,-10.965284587804918,,,Energy,CRF,,,COMPLETE
24,0.704767501741445,2026-06-15 23:07:36.345881,2026-06-15 23:07:36.362612,0 days 00:00:00.016731,0.8940303654681623,-0.3114892577130801,,,Energy,CRF,,,COMPLETE
25,0.704767501741445,2026-06-15 23:07:36.363139,2026-06-15 23:07:36.381379,0 days 00:00:00.018240,6.407503577382925,-9.503712843377322,,,Energy,CRF,,,COMPLETE
26,0.704767501741445,2026-06-15 23:07:36.382629,2026-06-15 23:07:36.402822,0 days 00:00:00.020193,8.186227851139574,-1.2078862453407186,,,Energy,CRF,,,COMPLETE
27,0.0,2026-06-15 23:07:36.403411,2026-06-15 23:07:36.415965,0 days 00:00:00.012554,2.514051682990096,-8.099059939022181,,,Energy,CRF,,,COMPLETE
28,0.5286087959685235,2026-06-15 23:07:36.416482,2026-06-15 23:07:36.544987,0 days 00:00:00.128505,,,18.0,0.7552703523274766,MCDropout,normal,,,COMPLETE
29,0.0,2026-06-15 23:07:36.545462,2026-06-15 23:07:36.582647,0 days 00:00:00.037185,,,,,Temperature,Mix,2.625705318979205,0.9981796985633347,COMPLETE
30,0.0,2026-06-15 23:07:36.583162,2026-06-15 23:07:36.641061,0 days 00:00:00.057899,,,7.0,0.9976369789823473,MCDropout,normal,,,COMPLETE
31,0.704767501741445,2026-06-15 23:07:36.641575,2026-06-15 23:07:36.658111,0 days 00:00:00.016536,9.763231302289212,-4.58128280759507,,,Energy,CRF,,,COMPLETE
32,0.704767501741445,2026-06-15 23:07:36.658571,2026-06-15 23:07:36.674470,0 days 00:00:00.015899,8.406505902862394,-4.645644975815505,,,Energy,CRF,,,COMPLETE
33,0.704767501741445,2026-06-15 23:07:36.675151,2026-06-15 23:07:36.691294,0 days 00:00:00.016143,9.039301562663088,-2.7403402353383983,,,Energy,CRF,,,COMPLETE
34,0.704767501741445,2026-06-15 23:07:36.691886,2026-06-15 23:07:36.708433,0 days 00:00:00.016547,7.189389044976275,1.3980813988083227,,,Energy,CRF,,,COMPLETE
35,0.0,2026-06-15 23:07:36.708961,2026-06-15 23:07:36.717696,0 days 00:00:00.008735,,,,,Temperature,normal,7.052460832347295,0.5131514600883756,COMPLETE
36,0.704767501741445,2026-06-15 23:07:36.718281,2026-06-15 23:07:36.733222,0 days 00:00:00.014941,5.059910599647793,-6.548000534131383,,,Energy,CRF,,,COMPLETE
37,0.0,2026-06-15 23:07:36.733808,2026-06-15 23:07:36.745870,0 days 00:00:00.012062,,,,,Temperature,CRF,5.064062023329042,0.6582680465750792,COMPLETE
38,0.704767501741445,2026-06-15 23:07:36.746722,2026-06-15 23:07:36.763960,0 days 00:00:00.017238,9.987096884009333,-10.925511250016287,,,Energy,CRF,,,COMPLETE
39,0.6432828790766717,2026-06-15 23:07:36.764525,2026-06-15 23:07:36.944721,0 days 00:00:00.180196,,,21.0,0.5142019095124878,MCDropout,Mix,,,COMPLETE
40,0.0,2026-06-15 23:07:36.945251,2026-06-15 23:07:36.953740,0 days 00:00:00.008489,,,,,Temperature,normal,8.217806213328936,0.791862730856683,COMPLETE
41,0.704767501741445,2026-06-15 23:07:36.954262,2026-06-15 23:07:36.973241,0 days 00:00:00.018979,7.585475108770248,-2.798673256451565,,,Energy,CRF,,,COMPLETE
42,0.704767501741445,2026-06-15 23:07:36.973941,2026-06-15 23:07:36.991656,0 days 00:00:00.017715,8.704007079949386,-2.984975097233412,,,Energy,CRF,,,COMPLETE
43,0.704767501741445,2026-06-15 23:07:36.992081,2026-06-15 23:07:37.011754,0 days 00:00:00.019673,7.902387041252268,-0.43984337282087616,,,Energy,CRF,,,COMPLETE
44,0.704767501741445,2026-06-15 23:07:37.012478,2026-06-15 23:07:37.033171,0 days 00:00:00.020693,9.143453917643168,-4.136743334084938,,,Energy,CRF,,,COMPLETE
45,0.704767501741445,2026-06-15 23:07:37.034187,2026-06-15 23:07:37.051136,0 days 00:00:00.016949,8.879233096705962,-7.178669132492185,,,Energy,CRF,,,COMPLETE
46,0.5982812961025723,2026-06-15 23:07:37.051637,2026-06-15 23:07:37.097701,0 days 00:00:00.046064,5.565664209782243,-1.7375723016515519,,,Energy,Mix,,,COMPLETE
47,0.0,2026-06-15 23:07:37.098280,2026-06-15 23:07:37.108214,0 days 00:00:00.009934,,,,,Temperature,CRF,1.6991930930262638,0.9167532212032954,COMPLETE
48,0.5982812961025723,2026-06-15 23:07:37.108800,2026-06-15 23:07:37.154092,0 days 00:00:00.045292,6.965941337317222,1.0736458047118012,,,Energy,Mix,,,COMPLETE
49,0.704767501741445,2026-06-15 23:07:37.154654,2026-06-15 23:07:37.172294,0 days 00:00:00.017640,9.19055628430393,-5.445262995659199,,,Energy,CRF,,,COMPLETE
50,0.0,2026-06-15 23:07:37.172861,2026-06-15 23:07:37.216116,0 days 00:00:00.043255,,,,,Temperature,Mix,5.054095774970447,0.7331353063117813,COMPLETE
51,0.704767501741445,2026-06-15 23:07:37.216678,2026-06-15 23:07:37.236327,0 days 00:00:00.019649,2.0609072781201885,0.515960866901982,,,Energy,CRF,,,COMPLETE
52,0.7359831539327746,2026-06-15 23:07:37.236909,2026-06-15 23:07:37.256307,0 days 00:00:00.019398,0.10813085406999634,-1.3757561598879349,,,Energy,CRF,,,COMPLETE
53,0.704767501741445,2026-06-15 23:07:37.256841,2026-06-15 23:07:37.275687,0 days 00:00:00.018846,4.255183449177268,-3.0402206426635745,,,Energy,CRF,,,COMPLETE
54,0.704767501741445,2026-06-15 23:07:37.276204,2026-06-15 23:07:37.296992,0 days 00:00:00.020788,5.706330257689899,-6.383708892429995,,,Energy,CRF,,,COMPLETE
55,0.726384229864198,2026-06-15 23:07:37.297506,2026-06-15 23:07:37.315561,0 days 00:00:00.018055,0.908304390522497,-1.9325757344949124,,,Energy,CRF,,,COMPLETE
56,0.0,2026-06-15 23:07:37.316080,2026-06-15 23:07:37.328134,0 days 00:00:00.012054,0.10996403504314145,-8.48854764651377,,,Energy,CRF,,,COMPLETE
57,0.843425961680428,2026-06-15 23:07:37.328839,2026-06-15 23:07:37.429971,0 days 00:00:00.101132,,,12.0,0.6728603115517378,MCDropout,CRF,,,COMPLETE
58,0.686282994852655,2026-06-15 23:07:37.430513,2026-06-15 23:07:37.545329,0 days 00:00:00.114816,,,12.0,0.6611171260643683,MCDropout,Mix,,,COMPLETE
59,0.45429682784521497,2026-06-15 23:07:37.545934,2026-06-15 23:07:37.717736,0 days 00:00:00.171802,,,24.0,0.6467014803531854,MCDropout,normal,,,COMPLETE
60,0.8399773766103772,2026-06-15 23:07:37.718387,2026-06-15 23:07:37.821257,0 days 00:00:00.102870,,,12.0,0.8120032082226752,MCDropout,CRF,,,COMPLETE
61,0.8456176853249662,2026-06-15 23:07:37.821753,2026-06-15 23:07:37.919094,0 days 00:00:00.097341,,,12.0,0.7828397806014503,MCDropout,CRF,,,COMPLETE
62,0.8502932060224846,2026-06-15 23:07:37.919511,2026-06-15 23:07:38.017173,0 days 00:00:00.097662,,,12.0,0.7921411659490939,MCDropout,CRF,,,COMPLETE
63,0.8482513246682668,2026-06-15 23:07:38.017782,2026-06-15 23:07:38.113773,0 days 00:00:00.095991,,,12.0,0.7854648619184978,MCDropout,CRF,,,COMPLETE
64,0.8490053739616652,2026-06-15 23:07:38.114239,2026-06-15 23:07:38.212951,0 days 00:00:00.098712,,,12.0,0.7911031456238224,MCDropout,CRF,,,COMPLETE
65,0.842737850565598,2026-06-15 23:07:38.213422,2026-06-15 23:07:38.311576,0 days 00:00:00.098154,,,12.0,0.8010870292929209,MCDropout,CRF,,,COMPLETE
66,0.8462546677234901,2026-06-15 23:07:38.312032,2026-06-15 23:07:38.416369,0 days 00:00:00.104337,,,12.0,0.7952722204640101,MCDropout,CRF,,,COMPLETE
67,0.8509849675178072,2026-06-15 23:07:38.416840,2026-06-15 23:07:38.512226,0 days 00:00:00.095386,,,12.0,0.781818578550556,MCDropout,CRF,,,COMPLETE
68,0.8462996602135008,2026-06-15 23:07:38.512742,2026-06-15 23:07:38.608045,0 days 00:00:00.095303,,,12.0,0.7668939103824979,MCDropout,CRF,,,COMPLETE
69,0.8547003704873999,2026-06-15 23:07:38.608665,2026-06-15 23:07:38.712655,0 days 00:00:00.103990,,,13.0,0.7598985455458621,MCDropout,CRF,,,COMPLETE
70,0.8505879020429727,2026-06-15 23:07:38.713121,2026-06-15 23:07:38.828960,0 days 00:00:00.115839,,,15.0,0.7424251163993363,MCDropout,CRF,,,COMPLETE
71,0.8453589973515734,2026-06-15 23:07:38.829438,2026-06-15 23:07:38.959324,0 days 00:00:00.129886,,,15.0,0.7449691324942266,MCDropout,CRF,,,COMPLETE
72,0.8531378407089212,2026-06-15 23:07:38.959888,2026-06-15 23:07:39.048374,0 days 00:00:00.088486,,,10.0,0.7379756126411122,MCDropout,CRF,,,COMPLETE
73,0.8525268513584978,2026-06-15 23:07:39.048887,2026-06-15 23:07:39.127070,0 days 00:00:00.078183,,,9.0,0.7281083892506411,MCDropout,CRF,,,COMPLETE
74,0.8500028203690371,2026-06-15 23:07:39.127491,2026-06-15 23:07:39.203492,0 days 00:00:00.076001,,,8.0,0.7205089130399551,MCDropout,CRF,,,COMPLETE
75,0.8490580129642464,2026-06-15 23:07:39.203993,2026-06-15 23:07:39.280923,0 days 00:00:00.076930,,,9.0,0.7087331138437629,MCDropout,CRF,,,COMPLETE
76,0.8476734014250775,2026-06-15 23:07:39.281443,2026-06-15 23:07:39.358413,0 days 00:00:00.076970,,,9.0,0.7166128045555518,MCDropout,CRF,,,COMPLETE
77,0.8481363069245165,2026-06-15 23:07:39.358916,2026-06-15 23:07:39.434910,0 days 00:00:00.075994,,,9.0,0.719411114162042,MCDropout,CRF,,,COMPLETE
78,0.8472818774434059,2026-06-15 23:07:39.435420,2026-06-15 23:07:39.515579,0 days 00:00:00.080159,,,9.0,0.7103708572467143,MCDropout,CRF,,,COMPLETE
79,0.8456910084944129,2026-06-15 23:07:39.516009,2026-06-15 23:07:39.593134,0 days 00:00:00.077125,,,9.0,0.7161773548952592,MCDropout,CRF,,,COMPLETE
80,0.5173865757137104,2026-06-15 23:07:39.593610,2026-06-15 23:07:39.702230,0 days 00:00:00.108620,,,15.0,0.7398302541501294,MCDropout,normal,,,COMPLETE
81,0.8294560923450489,2026-06-15 23:07:39.702985,2026-06-15 23:07:39.789138,0 days 00:00:00.086153,,,10.0,0.8511519781171891,MCDropout,CRF,,,COMPLETE
82,0.8433888770551738,2026-06-15 23:07:39.789553,2026-06-15 23:07:39.838966,0 days 00:00:00.049413,,,5.0,0.6942737095812836,MCDropout,CRF,,,COMPLETE
83,0.8517664291253281,2026-06-15 23:07:39.839525,2026-06-15 23:07:39.958320,0 days 00:00:00.118795,,,14.0,0.747591554525387,MCDropout,CRF,,,COMPLETE
84,0.8501559976508588,2026-06-15 23:07:39.958809,2026-06-15 23:07:40.072406,0 days 00:00:00.113597,,,14.0,0.7442541289195405,MCDropout,CRF,,,COMPLETE
85,0.8482234073340562,2026-06-15 23:07:40.072917,2026-06-15 23:07:40.188356,0 days 00:00:00.115439,,,14.0,0.7501246239722089,MCDropout,CRF,,,COMPLETE
86,0.8531334609596994,2026-06-15 23:07:40.188898,2026-06-15 23:07:40.313765,0 days 00:00:00.124867,,,14.0,0.7486296557613669,MCDropout,CRF,,,COMPLETE
87,0.8391225027051377,2026-06-15 23:07:40.314241,2026-06-15 23:07:40.426611,0 days 00:00:00.112370,,,14.0,0.8376467081609699,MCDropout,CRF,,,COMPLETE
88,0.848590647934727,2026-06-15 23:07:40.427054,2026-06-15 23:07:40.556730,0 days 00:00:00.129676,,,17.0,0.7601731616410994,MCDropout,CRF,,,COMPLETE
89,0.840232311262529,2026-06-15 23:07:40.557255,2026-06-15 23:07:40.668083,0 days 00:00:00.110828,,,14.0,0.8254965896123655,MCDropout,CRF,,,COMPLETE
90,0.8503298540775852,2026-06-15 23:07:40.668643,2026-06-15 23:07:40.791692,0 days 00:00:00.123049,,,16.0,0.7609369263940764,MCDropout,CRF,,,COMPLETE
91,0.8516363788969856,2026-06-15 23:07:40.792205,2026-06-15 23:07:40.921847,0 days 00:00:00.129642,,,16.0,0.7659257251129286,MCDropout,CRF,,,COMPLETE
92,0.848698184026053,2026-06-15 23:07:40.922448,2026-06-15 23:07:41.057118,0 days 00:00:00.134670,,,17.0,0.7725425982209472,MCDropout,CRF,,,COMPLETE
93,0.8502759789647529,2026-06-15 23:07:41.057636,2026-06-15 23:07:41.186040,0 days 00:00:00.128404,,,16.0,0.7412659698945424,MCDropout,CRF,,,COMPLETE
94,0.8513664849068576,2026-06-15 23:07:41.186718,2026-06-15 23:07:41.334792,0 days 00:00:00.148074,,,19.0,0.7652283717246096,MCDropout,CRF,,,COMPLETE
95,0.8493525366409698,2026-06-15 23:07:41.335260,2026-06-15 23:07:41.502924,0 days 00:00:00.167664,,,22.0,0.7658916564172114,MCDropout,CRF,,,COMPLETE
96,0.8467154140924376,2026-06-15 23:07:41.503393,2026-06-15 23:07:41.654059,0 days 00:00:00.150666,,,20.0,0.681808815192632,MCDropout,CRF,,,COMPLETE
97,0.5154634610119191,2026-06-15 23:07:41.654670,2026-06-15 23:07:41.790119,0 days 00:00:00.135449,,,19.0,0.7370707930305579,MCDropout,normal,,,COMPLETE
98,0.8462350494684356,2026-06-15 23:07:41.790643,2026-06-15 23:07:41.912741,0 days 00:00:00.122098,,,16.0,0.7690400959283574,MCDropout,CRF,,,COMPLETE
99,0.8453024823885311,2026-06-15 23:07:41.913170,2026-06-15 23:07:42.051983,0 days 00:00:00.138813,,,18.0,0.614350855876052,MCDropout,CRF,,,COMPLETE
