number,value,datetime_start,datetime_complete,duration,params_max_iters,params_n_clusters,params_pca_components,params_random_state,params_scaler,params_tol,params_use_pca,state
0,0.3113323048291178,2026-06-16 23:54:34.734956,2026-06-16 23:54:34.763214,0 days 00:00:00.028258,520,3,,239,StandardScaler,2.3682531169371455e-05,False,COMPLETE
1,0.3101952017648415,2026-06-16 23:54:34.763750,2026-06-16 23:54:34.772823,0 days 00:00:00.009073,160,2,7.0,135,MinMaxScaler,0.00018445956727541768,True,COMPLETE
2,0.31440307327970785,2026-06-16 23:54:34.773893,2026-06-16 23:54:34.801459,0 days 00:00:00.027566,694,3,10.0,601,StandardScaler,0.009496345552998841,True,COMPLETE
3,0.695597554012276,2026-06-16 23:54:34.801856,2026-06-16 23:54:34.839397,0 days 00:00:00.037541,697,4,,338,MinMaxScaler,0.0009209660995105609,False,COMPLETE
4,0.3494951684764841,2026-06-16 23:54:34.839812,2026-06-16 23:54:34.860593,0 days 00:00:00.020781,940,3,,709,MinMaxScaler,1.0184443858770928e-05,False,COMPLETE
5,0.3101952017648415,2026-06-16 23:54:34.861192,2026-06-16 23:54:34.868614,0 days 00:00:00.007422,496,2,8.0,208,MinMaxScaler,0.0018141325075962196,True,COMPLETE
6,0.31508728250932977,2026-06-16 23:54:34.869425,2026-06-16 23:54:34.887573,0 days 00:00:00.018148,782,3,,336,StandardScaler,0.007370695327495348,False,COMPLETE
7,0.25502836125794515,2026-06-16 23:54:34.888276,2026-06-16 23:54:34.934241,0 days 00:00:00.045965,744,4,7.0,541,StandardScaler,0.0026864674163525584,True,COMPLETE
8,0.34987626348232226,2026-06-16 23:54:34.934642,2026-06-16 23:54:34.956190,0 days 00:00:00.021548,296,3,6.0,478,MinMaxScaler,0.0002800448912118258,True,COMPLETE
9,0.25502836125794515,2026-06-16 23:54:34.956965,2026-06-16 23:54:35.031473,0 days 00:00:00.074508,331,4,,145,StandardScaler,0.0007223174646271306,False,COMPLETE
10,0.695597554012276,2026-06-16 23:54:35.031918,2026-06-16 23:54:35.062406,0 days 00:00:00.030488,982,4,,1000,MinMaxScaler,6.425181805998726e-05,False,COMPLETE
11,0.695597554012276,2026-06-16 23:54:35.062888,2026-06-16 23:54:35.103353,0 days 00:00:00.040465,968,4,,974,MinMaxScaler,9.383097866088615e-05,False,COMPLETE
12,0.6965587683832416,2026-06-16 23:54:35.103888,2026-06-16 23:54:35.185498,0 days 00:00:00.081610,857,4,,990,MinMaxScaler,5.746751984502186e-05,False,COMPLETE
13,0.6985376096833548,2026-06-16 23:54:35.186086,2026-06-16 23:54:35.235490,0 days 00:00:00.049404,572,4,,7,MinMaxScaler,0.000644649539434322,False,COMPLETE
14,0.6965587683832416,2026-06-16 23:54:35.236187,2026-06-16 23:54:35.297895,0 days 00:00:00.061708,537,4,,7,MinMaxScaler,3.83322241220878e-05,False,COMPLETE
15,0.695597554012276,2026-06-16 23:54:35.298372,2026-06-16 23:54:35.331829,0 days 00:00:00.033457,846,4,,793,MinMaxScaler,0.00032804709813051764,False,COMPLETE
16,0.30461184507499756,2026-06-16 23:54:35.332282,2026-06-16 23:54:35.354180,0 days 00:00:00.021898,611,4,,811,MinMaxScaler,0.00011695380058015641,False,COMPLETE
17,0.3483727956447108,2026-06-16 23:54:35.354751,2026-06-16 23:54:35.375229,0 days 00:00:00.020478,383,3,,4,MinMaxScaler,0.0006068934973263562,False,COMPLETE
18,0.695597554012276,2026-06-16 23:54:35.375660,2026-06-16 23:54:35.409389,0 days 00:00:00.033729,877,4,,450,MinMaxScaler,1.0907658877902086e-05,False,COMPLETE
19,0.6909341764450722,2026-06-16 23:54:35.409899,2026-06-16 23:54:35.440755,0 days 00:00:00.030856,107,4,,877,MinMaxScaler,0.0025162111388485064,False,COMPLETE
20,0.3494951684764841,2026-06-16 23:54:35.442417,2026-06-16 23:54:35.468415,0 days 00:00:00.025998,622,3,,651,MinMaxScaler,2.3520285695378682e-05,False,COMPLETE
21,0.6965587683832416,2026-06-16 23:54:35.468844,2026-06-16 23:54:35.514699,0 days 00:00:00.045855,455,4,,20,MinMaxScaler,4.163445335252596e-05,False,COMPLETE
22,0.30459732047955523,2026-06-16 23:54:35.515177,2026-06-16 23:54:35.573667,0 days 00:00:00.058490,591,4,,81,MinMaxScaler,3.20011181529855e-05,False,COMPLETE
23,0.695597554012276,2026-06-16 23:54:35.574170,2026-06-16 23:54:35.609685,0 days 00:00:00.035515,236,4,,223,MinMaxScaler,5.002191674221449e-05,False,COMPLETE
24,0.2528730389449188,2026-06-16 23:54:35.610120,2026-06-16 23:54:35.659629,0 days 00:00:00.049509,403,4,,359,MinMaxScaler,0.0001575069832265736,False,COMPLETE
25,0.6965587683832416,2026-06-16 23:54:35.660106,2026-06-16 23:54:35.709643,0 days 00:00:00.049537,547,4,,91,MinMaxScaler,2.0169091637367548e-05,False,COMPLETE
26,0.5191558112066306,2026-06-16 23:54:35.710027,2026-06-16 23:54:35.741757,0 days 00:00:00.031730,825,4,2.0,281,StandardScaler,7.033328647390962e-05,True,COMPLETE
27,0.6975476573652432,2026-06-16 23:54:35.742320,2026-06-16 23:54:35.791347,0 days 00:00:00.049027,672,4,,439,MinMaxScaler,0.00036490329382163057,False,COMPLETE
28,0.3483727956447108,2026-06-16 23:54:35.791824,2026-06-16 23:54:35.807161,0 days 00:00:00.015337,715,3,,420,MinMaxScaler,0.00037681259798477804,False,COMPLETE
29,0.30881309502362464,2026-06-16 23:54:35.807602,2026-06-16 23:54:35.827435,0 days 00:00:00.019833,907,3,,727,StandardScaler,0.0013888408244945125,False,COMPLETE
30,0.6975476573652432,2026-06-16 23:54:35.827882,2026-06-16 23:54:35.874573,0 days 00:00:00.046691,648,4,,897,MinMaxScaler,0.0004693372495009294,False,COMPLETE
31,0.6965587683832416,2026-06-16 23:54:35.875064,2026-06-16 23:54:35.919684,0 days 00:00:00.044620,625,4,,918,MinMaxScaler,0.00023794333087223576,False,COMPLETE
32,0.695597554012276,2026-06-16 23:54:35.920139,2026-06-16 23:54:35.949917,0 days 00:00:00.029778,786,4,,898,MinMaxScaler,0.000495112508426081,False,COMPLETE
33,0.6935063408899788,2026-06-16 23:54:35.950413,2026-06-16 23:54:35.989931,0 days 00:00:00.039518,668,4,,564,MinMaxScaler,0.0010873749544415036,False,COMPLETE
34,0.3101952017648415,2026-06-16 23:54:35.990368,2026-06-16 23:54:36.006499,0 days 00:00:00.016131,670,2,2.0,829,MinMaxScaler,0.00016277693590675894,True,COMPLETE
35,0.663126466305201,2026-06-16 23:54:36.006961,2026-06-16 23:54:36.030387,0 days 00:00:00.023426,759,4,,941,MinMaxScaler,0.004112352646099764,False,COMPLETE
36,0.6975476573652432,2026-06-16 23:54:36.030804,2026-06-16 23:54:36.067299,0 days 00:00:00.036495,480,4,,672,MinMaxScaler,0.0005675193055163047,False,COMPLETE
37,0.6558601014948928,2026-06-16 23:54:36.067915,2026-06-16 23:54:36.098641,0 days 00:00:00.030726,481,4,4.0,657,StandardScaler,0.0005208030256303827,True,COMPLETE
38,0.30459732047955523,2026-06-16 23:54:36.099154,2026-06-16 23:54:36.122103,0 days 00:00:00.022949,567,4,,757,MinMaxScaler,0.0007784799925347019,False,COMPLETE
39,0.3101952017648415,2026-06-16 23:54:36.122567,2026-06-16 23:54:36.141256,0 days 00:00:00.018689,448,2,10.0,513,MinMaxScaler,0.0014883265765649025,True,COMPLETE
40,0.31195223582749176,2026-06-16 23:54:36.142149,2026-06-16 23:54:36.169706,0 days 00:00:00.027557,494,3,,656,StandardScaler,0.00043984766456668005,False,COMPLETE
41,0.6965587683832416,2026-06-16 23:54:36.170159,2026-06-16 23:54:36.216881,0 days 00:00:00.046722,668,4,,863,MinMaxScaler,0.00023599228016004824,False,COMPLETE
42,0.29346605601000375,2026-06-16 23:54:36.217260,2026-06-16 23:54:36.243046,0 days 00:00:00.025786,716,4,,588,MinMaxScaler,0.0008976834650970491,False,COMPLETE
43,0.6930777594668738,2026-06-16 23:54:36.243564,2026-06-16 23:54:36.290647,0 days 00:00:00.047083,413,4,,954,MinMaxScaler,0.00225667093250798,False,COMPLETE
44,0.3205455583274614,2026-06-16 23:54:36.291251,2026-06-16 23:54:36.318137,0 days 00:00:00.026886,816,4,,992,MinMaxScaler,0.005443471563574933,False,COMPLETE
45,0.6946118914923246,2026-06-16 23:54:36.318578,2026-06-16 23:54:36.357355,0 days 00:00:00.038777,573,4,,275,MinMaxScaler,0.0010626973857052419,False,COMPLETE
46,0.3046280257197025,2026-06-16 23:54:36.357826,2026-06-16 23:54:36.381297,0 days 00:00:00.023471,517,4,,168,MinMaxScaler,0.00012362580713241143,False,COMPLETE
47,0.29507971059249194,2026-06-16 23:54:36.381760,2026-06-16 23:54:36.422620,0 days 00:00:00.040860,319,4,,773,MinMaxScaler,0.00031433411793287813,False,COMPLETE
48,0.6558601014948928,2026-06-16 23:54:36.423043,2026-06-16 23:54:36.453663,0 days 00:00:00.030620,637,4,4.0,838,StandardScaler,0.00022419193035694854,True,COMPLETE
49,0.6985376096833548,2026-06-16 23:54:36.454113,2026-06-16 23:54:36.505258,0 days 00:00:00.051145,915,4,,387,MinMaxScaler,0.0006834134438086857,False,COMPLETE
50,0.6985376096833548,2026-06-16 23:54:36.505748,2026-06-16 23:54:36.552590,0 days 00:00:00.046842,530,4,,383,MinMaxScaler,0.0007016120859232994,False,COMPLETE
51,0.6965587683832416,2026-06-16 23:54:36.553059,2026-06-16 23:54:36.582045,0 days 00:00:00.028986,454,4,,365,MinMaxScaler,0.0006473615126458849,False,COMPLETE
52,0.29346605601000375,2026-06-16 23:54:36.582579,2026-06-16 23:54:36.616747,0 days 00:00:00.034168,522,4,,428,MinMaxScaler,0.0006642754517471469,False,COMPLETE
53,0.3046280257197025,2026-06-16 23:54:36.617172,2026-06-16 23:54:36.650195,0 days 00:00:00.033023,955,4,,489,MinMaxScaler,0.0004026598929951207,False,COMPLETE
54,0.6935063408899788,2026-06-16 23:54:36.650634,2026-06-16 23:54:36.693000,0 days 00:00:00.042366,576,4,,306,MinMaxScaler,0.0012417211661981124,False,COMPLETE
55,0.6888283401658994,2026-06-16 23:54:36.693469,2026-06-16 23:54:36.742499,0 days 00:00:00.049030,250,4,,191,MinMaxScaler,0.001715284521989353,False,COMPLETE
56,0.695597554012276,2026-06-16 23:54:36.742989,2026-06-16 23:54:36.779969,0 days 00:00:00.036980,647,4,,692,MinMaxScaler,0.0008802038642641715,False,COMPLETE
57,0.6975476573652432,2026-06-16 23:54:36.780505,2026-06-16 23:54:36.829338,0 days 00:00:00.048833,364,4,,608,MinMaxScaler,0.0005422789617637017,False,COMPLETE
58,0.6965587683832416,2026-06-16 23:54:36.829769,2026-06-16 23:54:36.872169,0 days 00:00:00.042400,913,4,,392,MinMaxScaler,0.000301269316698377,False,COMPLETE
59,0.6975476573652432,2026-06-16 23:54:36.872824,2026-06-16 23:54:36.922792,0 days 00:00:00.049968,605,4,,522,MinMaxScaler,0.0003775044911367334,False,COMPLETE
60,0.6569468622442145,2026-06-16 23:54:36.923204,2026-06-16 23:54:36.959999,0 days 00:00:00.036795,697,4,4.0,246,StandardScaler,0.0007403962118357958,True,COMPLETE
61,0.6975476573652432,2026-06-16 23:54:36.960450,2026-06-16 23:54:37.010387,0 days 00:00:00.049937,374,4,,460,MinMaxScaler,0.0005167805460617891,False,COMPLETE
62,0.695597554012276,2026-06-16 23:54:37.010826,2026-06-16 23:54:37.047198,0 days 00:00:00.036372,261,4,,632,MinMaxScaler,0.0005886139644471006,False,COMPLETE
63,0.695597554012276,2026-06-16 23:54:37.047677,2026-06-16 23:54:37.079938,0 days 00:00:00.032261,358,4,,325,MinMaxScaler,0.0004401788835445806,False,COMPLETE
64,0.695597554012276,2026-06-16 23:54:37.080422,2026-06-16 23:54:37.118275,0 days 00:00:00.037853,431,4,,552,MinMaxScaler,0.0002544227265582824,False,COMPLETE
65,0.695597554012276,2026-06-16 23:54:37.118676,2026-06-16 23:54:37.161307,0 days 00:00:00.042631,546,4,,600,MinMaxScaler,0.00019646059402286041,False,COMPLETE
66,0.695597554012276,2026-06-16 23:54:37.162082,2026-06-16 23:54:37.208160,0 days 00:00:00.046078,493,4,,393,MinMaxScaler,0.0010577018491842454,False,COMPLETE
67,0.695597554012276,2026-06-16 23:54:37.208674,2026-06-16 23:54:37.250801,0 days 00:00:00.042127,189,4,,709,MinMaxScaler,0.00035218510442723864,False,COMPLETE
68,0.695597554012276,2026-06-16 23:54:37.251206,2026-06-16 23:54:37.285576,0 days 00:00:00.034370,989,4,,112,MinMaxScaler,0.0008151282544552841,False,COMPLETE
69,0.6975476573652432,2026-06-16 23:54:37.286062,2026-06-16 23:54:37.329141,0 days 00:00:00.043079,346,4,,623,MinMaxScaler,0.0005489380895163937,False,COMPLETE
70,0.3678973298463812,2026-06-16 23:54:37.329610,2026-06-16 23:54:37.355190,0 days 00:00:00.025580,748,3,,62,MinMaxScaler,0.0016493186869334924,False,COMPLETE
71,0.695597554012276,2026-06-16 23:54:37.355712,2026-06-16 23:54:37.410924,0 days 00:00:00.055212,602,4,,487,MinMaxScaler,0.0003873318525042756,False,COMPLETE
72,0.6965587683832416,2026-06-16 23:54:37.412279,2026-06-16 23:54:37.449010,0 days 00:00:00.036731,546,4,,519,MinMaxScaler,0.00032158387181215005,False,COMPLETE
73,0.6975476573652432,2026-06-16 23:54:37.449447,2026-06-16 23:54:37.505297,0 days 00:00:00.055850,603,4,,525,MinMaxScaler,0.0004857982613713067,False,COMPLETE
74,0.695597554012276,2026-06-16 23:54:37.505819,2026-06-16 23:54:37.542292,0 days 00:00:00.036473,523,4,,433,MinMaxScaler,0.0006891326068615792,False,COMPLETE
75,0.698058377211984,2026-06-16 23:54:37.542742,2026-06-16 23:54:37.572577,0 days 00:00:00.029835,470,4,,394,MinMaxScaler,0.0011746027050301632,False,COMPLETE
76,0.6930777594668738,2026-06-16 23:54:37.573021,2026-06-16 23:54:37.612485,0 days 00:00:00.039464,399,4,,389,MinMaxScaler,0.0019864320611383403,False,COMPLETE
77,0.6791992207714709,2026-06-16 23:54:37.612975,2026-06-16 23:54:37.649798,0 days 00:00:00.036823,469,4,9.0,353,StandardScaler,0.0034821791683748303,True,COMPLETE
78,0.3101952017648415,2026-06-16 23:54:37.650407,2026-06-16 23:54:37.672250,0 days 00:00:00.021843,425,2,,300,MinMaxScaler,0.0013687414438200622,False,COMPLETE
79,0.695597554012276,2026-06-16 23:54:37.673094,2026-06-16 23:54:37.714604,0 days 00:00:00.041510,469,4,,572,MinMaxScaler,0.0006060132665711482,False,COMPLETE
80,0.30459732047955523,2026-06-16 23:54:37.715073,2026-06-16 23:54:37.769446,0 days 00:00:00.054373,502,4,,738,MinMaxScaler,0.0011181727554105151,False,COMPLETE
81,0.3046280257197025,2026-06-16 23:54:37.769928,2026-06-16 23:54:37.801270,0 days 00:00:00.031342,566,4,,467,MinMaxScaler,0.00044423490866714706,False,COMPLETE
82,0.6985376096833548,2026-06-16 23:54:37.801905,2026-06-16 23:54:37.831146,0 days 00:00:00.029241,633,4,,404,MinMaxScaler,0.0007463912526287118,False,COMPLETE
83,0.6985376096833548,2026-06-16 23:54:37.831710,2026-06-16 23:54:37.884889,0 days 00:00:00.053179,653,4,,266,MinMaxScaler,0.000875725928782014,False,COMPLETE
84,0.695597554012276,2026-06-16 23:54:37.885278,2026-06-16 23:54:37.924528,0 days 00:00:00.039250,653,4,,249,MinMaxScaler,0.0009575853838310872,False,COMPLETE
85,0.6926437752407062,2026-06-16 23:54:37.924979,2026-06-16 23:54:37.962988,0 days 00:00:00.038009,730,4,,410,MinMaxScaler,0.00125122244962212,False,COMPLETE
86,0.695597554012276,2026-06-16 23:54:37.963434,2026-06-16 23:54:38.015634,0 days 00:00:00.052200,788,4,,344,MinMaxScaler,0.0007926985525235991,False,COMPLETE
87,0.695597554012276,2026-06-16 23:54:38.016030,2026-06-16 23:54:38.055758,0 days 00:00:00.039728,588,4,,320,MinMaxScaler,0.0009926593434572283,False,COMPLETE
88,0.6820865099575575,2026-06-16 23:54:38.056175,2026-06-16 23:54:38.092303,0 days 00:00:00.036128,698,4,,369,StandardScaler,0.0007255866081120638,False,COMPLETE
89,0.6951672416118012,2026-06-16 23:54:38.092777,2026-06-16 23:54:38.130662,0 days 00:00:00.037885,676,4,5.0,31,MinMaxScaler,0.0008968867595560745,True,COMPLETE
90,0.3046280257197025,2026-06-16 23:54:38.131263,2026-06-16 23:54:38.162151,0 days 00:00:00.030888,635,4,,278,MinMaxScaler,0.0002724176703949558,False,COMPLETE
91,0.6975476573652432,2026-06-16 23:54:38.162637,2026-06-16 23:54:38.225704,0 days 00:00:00.063067,618,4,,451,MinMaxScaler,0.0005823154234372546,False,COMPLETE
92,0.695597554012276,2026-06-16 23:54:38.226176,2026-06-16 23:54:38.271904,0 days 00:00:00.045728,566,4,,155,MinMaxScaler,0.0004658622270593645,False,COMPLETE
93,0.6926437752407062,2026-06-16 23:54:38.272345,2026-06-16 23:54:38.312277,0 days 00:00:00.039932,306,4,,416,MinMaxScaler,0.0011809289815714653,False,COMPLETE
94,0.30461184507499756,2026-06-16 23:54:38.312744,2026-06-16 23:54:38.348404,0 days 00:00:00.035660,528,4,,811,MinMaxScaler,0.0006622140156671082,False,COMPLETE
95,0.6975476573652432,2026-06-16 23:54:38.348840,2026-06-16 23:54:38.399005,0 days 00:00:00.050165,860,4,,205,MinMaxScaler,0.0005413522976047305,False,COMPLETE
96,0.3046280257197025,2026-06-16 23:54:38.399434,2026-06-16 23:54:38.438517,0 days 00:00:00.039083,657,4,,488,MinMaxScaler,0.0008096665410080739,False,COMPLETE
97,0.6686502212219823,2026-06-16 23:54:38.438942,2026-06-16 23:54:38.467937,0 days 00:00:00.028995,508,4,,674,MinMaxScaler,0.00967935690077476,False,COMPLETE
98,0.6926437752407062,2026-06-16 23:54:38.468395,2026-06-16 23:54:38.506612,0 days 00:00:00.038217,766,4,,398,MinMaxScaler,0.001536654890305799,False,COMPLETE
99,0.695597554012276,2026-06-16 23:54:38.507053,2026-06-16 23:54:38.549924,0 days 00:00:00.042871,719,4,,376,MinMaxScaler,0.0004026327394847279,False,COMPLETE
100,0.695597554012276,2026-06-16 23:54:38.550456,2026-06-16 23:54:38.595626,0 days 00:00:00.045170,685,4,,257,MinMaxScaler,0.00021079017403074064,False,COMPLETE
101,0.695597554012276,2026-06-16 23:54:38.596211,2026-06-16 23:54:38.636291,0 days 00:00:00.040080,625,4,,442,MinMaxScaler,0.000357409976461303,False,COMPLETE
102,0.695597554012276,2026-06-16 23:54:38.636765,2026-06-16 23:54:38.682045,0 days 00:00:00.045280,595,4,,542,MinMaxScaler,0.0006308653148328718,False,COMPLETE
103,0.6965587683832416,2026-06-16 23:54:38.682528,2026-06-16 23:54:38.740066,0 days 00:00:00.057538,550,4,,506,MinMaxScaler,0.00017369287363232997,False,COMPLETE
104,0.2950487953391941,2026-06-16 23:54:38.740594,2026-06-16 23:54:38.789984,0 days 00:00:00.049390,617,4,,337,MinMaxScaler,0.00028017405356685105,False,COMPLETE
105,0.6960516058951906,2026-06-16 23:54:38.790419,2026-06-16 23:54:38.823274,0 days 00:00:00.032855,644,4,,474,MinMaxScaler,0.00048112221918208357,False,COMPLETE
106,0.6820865099575575,2026-06-16 23:54:38.823771,2026-06-16 23:54:38.881479,0 days 00:00:00.057708,442,4,,625,StandardScaler,0.00039189901010816184,False,COMPLETE
107,0.6647844312640288,2026-06-16 23:54:38.881962,2026-06-16 23:54:38.916049,0 days 00:00:00.034087,584,4,3.0,425,MinMaxScaler,0.0019390205026372993,True,COMPLETE
108,0.6965587683832416,2026-06-16 23:54:38.916643,2026-06-16 23:54:38.954951,0 days 00:00:00.038308,484,4,,594,MinMaxScaler,0.0007260141055658124,False,COMPLETE
109,0.6975476573652432,2026-06-16 23:54:38.955426,2026-06-16 23:54:39.018627,0 days 00:00:00.063201,896,4,,124,MinMaxScaler,0.0005456613088440179,False,COMPLETE
110,0.695597554012276,2026-06-16 23:54:39.019121,2026-06-16 23:54:39.057023,0 days 00:00:00.037902,554,4,,576,MinMaxScaler,0.0008515768655775059,False,COMPLETE
111,0.6975476573652432,2026-06-16 23:54:39.057472,2026-06-16 23:54:39.104549,0 days 00:00:00.047077,375,4,,448,MinMaxScaler,0.00051556886781923,False,COMPLETE
112,0.30459732047955523,2026-06-16 23:54:39.105022,2026-06-16 23:54:39.156490,0 days 00:00:00.051468,367,4,,499,MinMaxScaler,0.00034035159197910714,False,COMPLETE
113,0.6975476573652432,2026-06-16 23:54:39.156926,2026-06-16 23:54:39.217359,0 days 00:00:00.060433,325,4,,460,MinMaxScaler,0.0004303840757418395,False,COMPLETE
114,0.695597554012276,2026-06-16 23:54:39.217775,2026-06-16 23:54:39.259422,0 days 00:00:00.041647,468,4,,380,MinMaxScaler,0.0006013279803822681,False,COMPLETE
115,0.695597554012276,2026-06-16 23:54:39.259873,2026-06-16 23:54:39.307029,0 days 00:00:00.047156,390,4,,552,MinMaxScaler,0.000992547978768201,False,COMPLETE
116,0.695597554012276,2026-06-16 23:54:39.307635,2026-06-16 23:54:39.355633,0 days 00:00:00.047998,415,4,,351,MinMaxScaler,0.0007062649650363961,False,COMPLETE
117,0.6946118914923246,2026-06-16 23:54:39.356114,2026-06-16 23:54:39.401324,0 days 00:00:00.045210,348,4,,527,MinMaxScaler,0.0013635853478306448,False,COMPLETE
118,0.695597554012276,2026-06-16 23:54:39.401886,2026-06-16 23:54:39.452711,0 days 00:00:00.050825,607,4,,912,MinMaxScaler,0.000297531046676583,False,COMPLETE
119,0.695597554012276,2026-06-16 23:54:39.453222,2026-06-16 23:54:39.502437,0 days 00:00:00.049215,296,4,,408,MinMaxScaler,0.0005163281617914294,False,COMPLETE
120,0.6820865099575575,2026-06-16 23:54:39.503074,2026-06-16 23:54:39.561688,0 days 00:00:00.058614,537,4,,302,StandardScaler,0.0009008944744382979,False,COMPLETE
121,0.695597554012276,2026-06-16 23:54:39.562286,2026-06-16 23:54:39.616465,0 days 00:00:00.054179,331,4,,647,MinMaxScaler,0.0006171847746789141,False,COMPLETE
122,0.6975476573652432,2026-06-16 23:54:39.617003,2026-06-16 23:54:39.685863,0 days 00:00:00.068860,283,4,,617,MinMaxScaler,0.00046119399910105855,False,COMPLETE
123,0.6975476573652432,2026-06-16 23:54:39.686399,2026-06-16 23:54:39.752476,0 days 00:00:00.066077,403,4,,694,MinMaxScaler,0.00037970960871241044,False,COMPLETE
124,0.6975476573652432,2026-06-16 23:54:39.753036,2026-06-16 23:54:39.800672,0 days 00:00:00.047636,346,4,,476,MinMaxScaler,0.0005312206108494462,False,COMPLETE
125,0.695597554012276,2026-06-16 23:54:39.801091,2026-06-16 23:54:39.850828,0 days 00:00:00.049737,701,4,,855,MinMaxScaler,0.0007591738200334539,False,COMPLETE
126,0.6925751358050175,2026-06-16 23:54:39.851377,2026-06-16 23:54:39.888722,0 days 00:00:00.037345,665,4,6.0,782,MinMaxScaler,0.0010553863237639472,True,COMPLETE
127,0.29346605601000375,2026-06-16 23:54:39.889217,2026-06-16 23:54:39.933657,0 days 00:00:00.044440,431,4,,428,MinMaxScaler,0.0006933940073266494,False,COMPLETE
128,0.3101952017648415,2026-06-16 23:54:39.934106,2026-06-16 23:54:39.959322,0 days 00:00:00.025216,815,2,,462,MinMaxScaler,0.00025453534112335083,False,COMPLETE
129,0.6975476573652432,2026-06-16 23:54:39.959743,2026-06-16 23:54:40.010704,0 days 00:00:00.050961,633,4,,367,MinMaxScaler,0.0005698030570102571,False,COMPLETE
130,0.6977307320915375,2026-06-16 23:54:40.011145,2026-06-16 23:54:40.050486,0 days 00:00:00.039341,589,4,,746,MinMaxScaler,0.0012161053424934107,False,COMPLETE
131,0.6926437752407062,2026-06-16 23:54:40.050983,2026-06-16 23:54:40.103621,0 days 00:00:00.052638,219,4,,711,MinMaxScaler,0.0012695838248166173,False,COMPLETE
132,0.6985376096833548,2026-06-16 23:54:40.104142,2026-06-16 23:54:40.160333,0 days 00:00:00.056191,575,4,,663,MinMaxScaler,0.0008955381781748728,False,COMPLETE
133,0.6985376096833548,2026-06-16 23:54:40.160772,2026-06-16 23:54:40.212138,0 days 00:00:00.051366,583,4,,672,MinMaxScaler,0.0008288842475119624,False,COMPLETE
