number,value,datetime_start,datetime_complete,duration,params_eps,params_min_samples,params_pca_components,params_scaler,params_use_pca,state
0,0.0,2026-06-17 01:56:27.876855,2026-06-17 01:56:29.449915,0 days 00:00:01.573060,4.672973136197572,20,,StandardScaler,False,COMPLETE
1,0.37300807158300964,2026-06-17 01:56:29.450462,2026-06-17 01:56:29.996734,0 days 00:00:00.546272,0.20438916108813726,9,8.0,MinMaxScaler,True,COMPLETE
2,0.0008164882756452089,2026-06-17 01:56:29.997193,2026-06-17 01:56:30.273081,0 days 00:00:00.275888,0.23189169929465053,9,3.0,StandardScaler,True,COMPLETE
3,0.0,2026-06-17 01:56:30.273591,2026-06-17 01:56:32.212293,0 days 00:00:01.938702,1.2538441417707724,3,9.0,MinMaxScaler,True,COMPLETE
4,0.006687554128328654,2026-06-17 01:56:32.212783,2026-06-17 01:56:33.287955,0 days 00:00:01.075172,2.642869617218254,14,,StandardScaler,False,COMPLETE
5,0.010653408692643003,2026-06-17 01:56:33.288405,2026-06-17 01:56:34.205525,0 days 00:00:00.917120,2.3152534192558254,11,,StandardScaler,False,COMPLETE
6,0.0004362376097006438,2026-06-17 01:56:34.206116,2026-06-17 01:56:35.118878,0 days 00:00:00.912762,3.187886108768968,8,7.0,StandardScaler,True,COMPLETE
7,0.0,2026-06-17 01:56:35.119343,2026-06-17 01:56:37.611071,0 days 00:00:02.491728,2.1361887610661605,12,,MinMaxScaler,False,COMPLETE
8,0.01209759420122021,2026-06-17 01:56:37.611477,2026-06-17 01:56:38.625608,0 days 00:00:01.014131,2.101957075913658,7,,StandardScaler,False,COMPLETE
9,0.0,2026-06-17 01:56:38.626061,2026-06-17 01:56:41.114740,0 days 00:00:02.488679,4.384509987170223,17,,MinMaxScaler,False,COMPLETE
10,0.3097780326833837,2026-06-17 01:56:41.115185,2026-06-17 01:56:41.481206,0 days 00:00:00.366021,0.1497919635511888,2,2.0,MinMaxScaler,True,COMPLETE
11,0.339589087578623,2026-06-17 01:56:41.481696,2026-06-17 01:56:41.819077,0 days 00:00:00.337381,0.1107445869853307,2,2.0,MinMaxScaler,True,COMPLETE
12,0.0,2026-06-17 01:56:41.819839,2026-06-17 01:56:43.366106,0 days 00:00:01.546267,0.9726339905859605,5,6.0,MinMaxScaler,True,COMPLETE
13,0.0,2026-06-17 01:56:43.366698,2026-06-17 01:56:44.970493,0 days 00:00:01.603795,0.9514033187856663,5,10.0,MinMaxScaler,True,COMPLETE
14,0.2223322285733797,2026-06-17 01:56:44.971063,2026-06-17 01:56:45.385182,0 days 00:00:00.414119,0.11592492231341711,14,5.0,MinMaxScaler,True,COMPLETE
15,0.0,2026-06-17 01:56:45.385617,2026-06-17 01:56:47.195968,0 days 00:00:01.810351,1.371990899876744,5,4.0,MinMaxScaler,True,COMPLETE
16,0.0,2026-06-17 01:56:47.196455,2026-06-17 01:56:48.376796,0 days 00:00:01.180341,0.673059652117046,11,8.0,MinMaxScaler,True,COMPLETE
17,0.0,2026-06-17 01:56:48.377301,2026-06-17 01:56:50.178498,0 days 00:00:01.801197,1.61716649033395,2,2.0,MinMaxScaler,True,COMPLETE
18,0.0,2026-06-17 01:56:50.178982,2026-06-17 01:56:51.299266,0 days 00:00:01.120284,0.658232438157915,7,5.0,MinMaxScaler,True,COMPLETE
19,0.0,2026-06-17 01:56:51.299725,2026-06-17 01:56:52.333949,0 days 00:00:01.034224,0.5594275862774453,17,7.0,MinMaxScaler,True,COMPLETE
20,0.0,2026-06-17 01:56:52.334513,2026-06-17 01:56:54.520290,0 days 00:00:02.185777,1.720682156621785,4,10.0,MinMaxScaler,True,COMPLETE
21,0.33958953453812557,2026-06-17 01:56:54.520807,2026-06-17 01:56:54.849186,0 days 00:00:00.328379,0.11217729073353752,2,2.0,MinMaxScaler,True,COMPLETE
22,0.0,2026-06-17 01:56:54.849647,2026-06-17 01:56:55.483124,0 days 00:00:00.633477,0.3528676612635538,2,3.0,MinMaxScaler,True,COMPLETE
23,0.5298225027536195,2026-06-17 01:56:55.483581,2026-06-17 01:56:55.800126,0 days 00:00:00.316545,0.06607268571601682,4,3.0,MinMaxScaler,True,COMPLETE
24,0.0,2026-06-17 01:56:55.800585,2026-06-17 01:56:57.117560,0 days 00:00:01.316975,0.8764393438293338,6,4.0,MinMaxScaler,True,COMPLETE
25,0.0,2026-06-17 01:56:57.117979,2026-06-17 01:56:58.701625,0 days 00:00:01.583646,1.1746914636399048,9,3.0,MinMaxScaler,True,COMPLETE
26,0.0,2026-06-17 01:56:58.702308,2026-06-17 01:56:59.536022,0 days 00:00:00.833714,0.5308578139067925,4,4.0,MinMaxScaler,True,COMPLETE
27,0.0,2026-06-17 01:56:59.536447,2026-06-17 01:57:01.673121,0 days 00:00:02.136674,3.763046989167515,9,8.0,MinMaxScaler,True,COMPLETE
28,0.0,2026-06-17 01:57:01.673594,2026-06-17 01:57:02.600408,0 days 00:00:00.926814,0.5338769958250007,4,6.0,MinMaxScaler,True,COMPLETE
29,0.020307013518154917,2026-06-17 01:57:02.601024,2026-06-17 01:57:03.529760,0 days 00:00:00.928736,1.648986232273511,7,,StandardScaler,False,COMPLETE
30,0.39205435416939666,2026-06-17 01:57:03.530293,2026-06-17 01:57:03.831764,0 days 00:00:00.301471,0.0635053665299564,6,3.0,MinMaxScaler,True,COMPLETE
31,0.20116277612445435,2026-06-17 01:57:03.832172,2026-06-17 01:57:04.149450,0 days 00:00:00.317278,0.05600109195107971,6,3.0,MinMaxScaler,True,COMPLETE
32,0.0,2026-06-17 01:57:04.150035,2026-06-17 01:57:04.970247,0 days 00:00:00.820212,0.4462414654728767,3,2.0,MinMaxScaler,True,COMPLETE
33,0.0,2026-06-17 01:57:04.970844,2026-06-17 01:57:06.252719,0 days 00:00:01.281875,0.7835378867227647,10,4.0,MinMaxScaler,True,COMPLETE
34,0.14435933725119193,2026-06-17 01:57:06.253197,2026-06-17 01:57:06.551254,0 days 00:00:00.298057,0.37009274284117377,8,3.0,StandardScaler,True,COMPLETE
35,0.0,2026-06-17 01:57:06.551979,2026-06-17 01:57:08.311245,0 days 00:00:01.759266,1.1722513461588902,3,5.0,MinMaxScaler,True,COMPLETE
36,0.0,2026-06-17 01:57:08.311767,2026-06-17 01:57:09.078015,0 days 00:00:00.766248,0.26249689086512185,6,,StandardScaler,False,COMPLETE
37,0.50395564994744,2026-06-17 01:57:09.078450,2026-06-17 01:57:09.343128,0 days 00:00:00.264678,0.0505943045079745,13,2.0,MinMaxScaler,True,COMPLETE
38,0.0,2026-06-17 01:57:09.343537,2026-06-17 01:57:10.736043,0 days 00:00:01.392506,0.9254699304910168,13,3.0,MinMaxScaler,True,COMPLETE
39,0.0,2026-06-17 01:57:10.736464,2026-06-17 01:57:11.520888,0 days 00:00:00.784424,0.379023009024422,16,,StandardScaler,False,COMPLETE
40,0.0,2026-06-17 01:57:11.521344,2026-06-17 01:57:13.555821,0 days 00:00:02.034477,1.417942624302648,19,9.0,MinMaxScaler,True,COMPLETE
41,0.35356286200506937,2026-06-17 01:57:13.556259,2026-06-17 01:57:13.871645,0 days 00:00:00.315386,0.10315877412972842,12,2.0,MinMaxScaler,True,COMPLETE
42,0.5981441753051955,2026-06-17 01:57:13.872215,2026-06-17 01:57:14.162972,0 days 00:00:00.290757,0.057214702515151886,12,2.0,MinMaxScaler,True,COMPLETE
43,0.0,2026-06-17 01:57:14.163749,2026-06-17 01:57:14.812974,0 days 00:00:00.649225,0.35661739362695455,15,3.0,MinMaxScaler,True,COMPLETE
44,0.0,2026-06-17 01:57:14.813438,2026-06-17 01:57:15.998701,0 days 00:00:01.185263,0.7354061392396133,11,2.0,MinMaxScaler,True,COMPLETE
45,0.012150195453161103,2026-06-17 01:57:15.999277,2026-06-17 01:57:17.011022,0 days 00:00:01.011745,0.30257605242248364,13,,MinMaxScaler,False,COMPLETE
46,0.0,2026-06-17 01:57:17.011447,2026-06-17 01:57:18.993790,0 days 00:00:01.982343,2.8999716609408464,10,2.0,MinMaxScaler,True,COMPLETE
47,0.0,2026-06-17 01:57:18.994231,2026-06-17 01:57:19.297093,0 days 00:00:00.302862,0.055145732865162174,8,3.0,StandardScaler,True,COMPLETE
48,0.0,2026-06-17 01:57:19.297566,2026-06-17 01:57:20.807687,0 days 00:00:01.510121,1.0402977647285838,13,4.0,MinMaxScaler,True,COMPLETE
49,0.0,2026-06-17 01:57:20.808152,2026-06-17 01:57:22.215277,0 days 00:00:01.407125,0.5871280778094297,12,,MinMaxScaler,False,COMPLETE
50,0.0,2026-06-17 01:57:22.215794,2026-06-17 01:57:23.482801,0 days 00:00:01.267007,0.7501397289048592,14,6.0,MinMaxScaler,True,COMPLETE
51,0.00018719462477586417,2026-06-17 01:57:23.483218,2026-06-17 01:57:24.039700,0 days 00:00:00.556482,0.2581318044967651,12,2.0,MinMaxScaler,True,COMPLETE
52,0.5870149416809078,2026-06-17 01:57:24.040267,2026-06-17 01:57:24.328864,0 days 00:00:00.288597,0.05213071366431563,11,2.0,MinMaxScaler,True,COMPLETE
53,0.0,2026-06-17 01:57:24.329429,2026-06-17 01:57:26.275610,0 days 00:00:01.946181,4.773624914663674,10,2.0,MinMaxScaler,True,COMPLETE
54,0.003149517862657523,2026-06-17 01:57:26.276346,2026-06-17 01:57:26.730387,0 days 00:00:00.454041,0.25244622240788445,9,3.0,MinMaxScaler,True,COMPLETE
55,0.0004362376097006438,2026-06-17 01:57:26.731018,2026-06-17 01:57:27.733591,0 days 00:00:01.002573,0.48233320589069184,11,9.0,MinMaxScaler,True,COMPLETE
56,0.0,2026-06-17 01:57:27.734056,2026-06-17 01:57:29.699491,0 days 00:00:01.965435,4.433718186926892,10,2.0,MinMaxScaler,True,COMPLETE
57,0.4241659484474338,2026-06-17 01:57:29.700067,2026-06-17 01:57:30.255613,0 days 00:00:00.555546,0.21357781349842592,14,8.0,MinMaxScaler,True,COMPLETE
58,-0.05475310493856243,2026-06-17 01:57:30.256082,2026-06-17 01:57:30.558118,0 days 00:00:00.302036,0.05673771151142418,15,3.0,MinMaxScaler,True,COMPLETE
59,0.0,2026-06-17 01:57:30.558619,2026-06-17 01:57:31.638414,0 days 00:00:01.079795,0.6314026663761502,15,2.0,MinMaxScaler,True,COMPLETE
60,0.43261969564443603,2026-06-17 01:57:31.638876,2026-06-17 01:57:32.199181,0 days 00:00:00.560305,0.21269093441837805,18,7.0,MinMaxScaler,True,COMPLETE
61,0.37462560118327926,2026-06-17 01:57:32.199607,2026-06-17 01:57:32.801411,0 days 00:00:00.601804,0.25396439580540464,20,8.0,MinMaxScaler,True,COMPLETE
62,0.0,2026-06-17 01:57:32.802314,2026-06-17 01:57:33.756418,0 days 00:00:00.954104,0.4919721808948028,18,7.0,MinMaxScaler,True,COMPLETE
63,0.4302170177757972,2026-06-17 01:57:33.756852,2026-06-17 01:57:34.387661,0 days 00:00:00.630809,0.21767760328746694,16,9.0,MinMaxScaler,True,COMPLETE
64,0.3779096900512702,2026-06-17 01:57:34.388249,2026-06-17 01:57:35.001232,0 days 00:00:00.612983,0.23529055694866066,16,9.0,MinMaxScaler,True,COMPLETE
65,0.0,2026-06-17 01:57:35.001676,2026-06-17 01:57:36.402126,0 days 00:00:01.400450,0.8299827959334743,18,8.0,MinMaxScaler,True,COMPLETE
66,0.0,2026-06-17 01:57:36.402796,2026-06-17 01:57:37.581754,0 days 00:00:01.178958,0.6307226296636244,16,9.0,MinMaxScaler,True,COMPLETE
67,0.0029084941640626187,2026-06-17 01:57:37.582216,2026-06-17 01:57:38.457970,0 days 00:00:00.875754,0.44195613778363074,17,7.0,MinMaxScaler,True,COMPLETE
68,0.0,2026-06-17 01:57:38.458486,2026-06-17 01:57:40.208681,0 days 00:00:01.750195,1.0698256638144825,19,10.0,MinMaxScaler,True,COMPLETE
69,0.0,2026-06-17 01:57:40.209098,2026-06-17 01:57:40.742826,0 days 00:00:00.533728,0.2267120872109389,14,8.0,StandardScaler,True,COMPLETE
70,0.001148976712599469,2026-06-17 01:57:40.743284,2026-06-17 01:57:41.688699,0 days 00:00:00.945415,0.4532590245687338,13,9.0,MinMaxScaler,True,COMPLETE
71,0.4234049750873805,2026-06-17 01:57:41.689572,2026-06-17 01:57:42.363007,0 days 00:00:00.673435,0.1670053951003203,15,10.0,MinMaxScaler,True,COMPLETE
72,0.444377662530968,2026-06-17 01:57:42.363711,2026-06-17 01:57:42.975297,0 days 00:00:00.611586,0.1930503490879968,14,10.0,MinMaxScaler,True,COMPLETE
73,0.005160808200824109,2026-06-17 01:57:42.975892,2026-06-17 01:57:43.849244,0 days 00:00:00.873352,0.37724103364028483,14,10.0,MinMaxScaler,True,COMPLETE
74,0.445308891131498,2026-06-17 01:57:43.849682,2026-06-17 01:57:44.433414,0 days 00:00:00.583732,0.19407986781893524,16,9.0,MinMaxScaler,True,COMPLETE
75,0.0,2026-06-17 01:57:44.433847,2026-06-17 01:57:45.904034,0 days 00:00:01.470187,0.6269712529768424,17,,MinMaxScaler,False,COMPLETE
76,0.4232166536205189,2026-06-17 01:57:45.904512,2026-06-17 01:57:46.469588,0 days 00:00:00.565076,0.1694807893572026,18,10.0,MinMaxScaler,True,COMPLETE
77,0.007264883528100189,2026-06-17 01:57:46.470319,2026-06-17 01:57:47.252760,0 days 00:00:00.782441,0.3701177133731721,19,9.0,MinMaxScaler,True,COMPLETE
78,0.0,2026-06-17 01:57:47.253332,2026-06-17 01:57:48.605508,0 days 00:00:01.352176,0.8597407012761424,16,5.0,MinMaxScaler,True,COMPLETE
79,0.0,2026-06-17 01:57:48.605949,2026-06-17 01:57:49.018242,0 days 00:00:00.412293,0.5313698673842902,13,6.0,StandardScaler,True,COMPLETE
80,0.0,2026-06-17 01:57:49.018772,2026-06-17 01:57:49.572785,0 days 00:00:00.554013,0.06327446699374968,15,10.0,MinMaxScaler,True,COMPLETE
81,0.42881869420185953,2026-06-17 01:57:49.573194,2026-06-17 01:57:50.094971,0 days 00:00:00.521777,0.16774109294299905,14,8.0,MinMaxScaler,True,COMPLETE
82,0.4444045211003016,2026-06-17 01:57:50.095564,2026-06-17 01:57:50.665312,0 days 00:00:00.569748,0.17418035949572325,12,9.0,MinMaxScaler,True,COMPLETE
83,0.0,2026-06-17 01:57:50.665792,2026-06-17 01:57:52.977927,0 days 00:00:02.312135,3.775390350765698,11,9.0,MinMaxScaler,True,COMPLETE
84,0.009504482880479491,2026-06-17 01:57:52.978370,2026-06-17 01:57:53.682176,0 days 00:00:00.703806,0.32797226611492103,12,9.0,MinMaxScaler,True,COMPLETE
85,0.0,2026-06-17 01:57:53.682647,2026-06-17 01:57:54.900727,0 days 00:00:01.218080,0.7513261025296158,12,2.0,MinMaxScaler,True,COMPLETE
86,0.007715994988906055,2026-06-17 01:57:54.901175,2026-06-17 01:57:55.909743,0 days 00:00:01.008568,0.35836380196617945,13,,MinMaxScaler,False,COMPLETE
87,0.549270391831462,2026-06-17 01:57:55.910204,2026-06-17 01:57:56.518831,0 days 00:00:00.608627,0.144149873428164,11,10.0,MinMaxScaler,True,COMPLETE
88,0.0,2026-06-17 01:57:56.519276,2026-06-17 01:57:57.077398,0 days 00:00:00.558122,0.059646756220250036,11,10.0,MinMaxScaler,True,COMPLETE
89,0.0,2026-06-17 01:57:57.077862,2026-06-17 01:57:58.184573,0 days 00:00:01.106711,0.528232570810967,11,10.0,MinMaxScaler,True,COMPLETE
90,0.3565770064655442,2026-06-17 01:57:58.184997,2026-06-17 01:57:58.513965,0 days 00:00:00.328968,0.6975462986962715,12,2.0,StandardScaler,True,COMPLETE
91,0.43942334456863413,2026-06-17 01:57:58.514472,2026-06-17 01:57:59.080242,0 days 00:00:00.565770,0.17154341638208329,13,9.0,MinMaxScaler,True,COMPLETE
92,0.4332659181024268,2026-06-17 01:57:59.080714,2026-06-17 01:57:59.692757,0 days 00:00:00.612043,0.1687848548983307,13,10.0,MinMaxScaler,True,COMPLETE
93,0.009504482880479491,2026-06-17 01:57:59.693266,2026-06-17 01:58:00.442784,0 days 00:00:00.749518,0.33272467170990233,13,10.0,MinMaxScaler,True,COMPLETE
94,0.21900459551865892,2026-06-17 01:58:00.443381,2026-06-17 01:58:01.020689,0 days 00:00:00.577308,0.11947071945283969,12,10.0,MinMaxScaler,True,COMPLETE
95,0.001148976712599469,2026-06-17 01:58:01.021324,2026-06-17 01:58:01.963748,0 days 00:00:00.942424,0.45394167001592683,13,9.0,MinMaxScaler,True,COMPLETE
96,0.0,2026-06-17 01:58:01.964210,2026-06-17 01:58:02.517667,0 days 00:00:00.553457,0.05261435008337312,10,10.0,MinMaxScaler,True,COMPLETE
97,0.3096972441940953,2026-06-17 01:58:02.518265,2026-06-17 01:58:02.925642,0 days 00:00:00.407377,0.17841120500587992,12,2.0,MinMaxScaler,True,COMPLETE
98,0.33560231673335345,2026-06-17 01:58:02.926063,2026-06-17 01:58:03.887479,0 days 00:00:00.961416,0.2750643898610066,14,,MinMaxScaler,False,COMPLETE
99,0.0015865569695760295,2026-06-17 01:58:03.887957,2026-06-17 01:58:04.756413,0 days 00:00:00.868456,0.42023537630461405,11,9.0,MinMaxScaler,True,COMPLETE
100,0.0,2026-06-17 01:58:04.756999,2026-06-17 01:58:05.971377,0 days 00:00:01.214378,0.6098368284028363,13,10.0,MinMaxScaler,True,COMPLETE
101,0.4360072095006755,2026-06-17 01:58:05.971792,2026-06-17 01:58:06.417389,0 days 00:00:00.445597,0.16256768916238157,12,6.0,MinMaxScaler,True,COMPLETE
102,0.005948739367248424,2026-06-17 01:58:06.417887,2026-06-17 01:58:06.910785,0 days 00:00:00.492898,0.2969119210267672,12,4.0,MinMaxScaler,True,COMPLETE
103,0.31166357877812945,2026-06-17 01:58:06.911323,2026-06-17 01:58:07.267618,0 days 00:00:00.356295,0.1540815738539244,11,2.0,MinMaxScaler,True,COMPLETE
104,0.4199149041392482,2026-06-17 01:58:07.268145,2026-06-17 01:58:07.847730,0 days 00:00:00.579585,0.13500357346635725,13,10.0,MinMaxScaler,True,COMPLETE
105,0.0,2026-06-17 01:58:07.848146,2026-06-17 01:58:08.690996,0 days 00:00:00.842850,0.5013607374679161,10,3.0,MinMaxScaler,True,COMPLETE
106,0.325940593231825,2026-06-17 01:58:08.691829,2026-06-17 01:58:09.238236,0 days 00:00:00.546407,0.26489377646023815,12,6.0,MinMaxScaler,True,COMPLETE
107,0.004244260197950464,2026-06-17 01:58:09.238718,2026-06-17 01:58:10.076479,0 days 00:00:00.837761,0.4012655385468434,14,9.0,MinMaxScaler,True,COMPLETE
108,0.3107715766569025,2026-06-17 01:58:10.077085,2026-06-17 01:58:10.459620,0 days 00:00:00.382535,0.15790336166453947,13,2.0,MinMaxScaler,True,COMPLETE
109,0.012490472010169638,2026-06-17 01:58:10.460117,2026-06-17 01:58:11.117137,0 days 00:00:00.657020,0.3091557450204,11,8.0,MinMaxScaler,True,COMPLETE
110,0.003038726611031747,2026-06-17 01:58:11.117622,2026-06-17 01:58:11.690341,0 days 00:00:00.572719,2.235567573430167,3,5.0,StandardScaler,True,COMPLETE
111,0.42677949286592387,2026-06-17 01:58:11.690934,2026-06-17 01:58:12.186074,0 days 00:00:00.495140,0.20877116436786844,15,6.0,MinMaxScaler,True,COMPLETE
112,0.0,2026-06-17 01:58:12.186597,2026-06-17 01:58:13.230198,0 days 00:00:01.043601,0.5552944597616933,9,7.0,MinMaxScaler,True,COMPLETE
113,0.0,2026-06-17 01:58:13.230721,2026-06-17 01:58:13.844623,0 days 00:00:00.613902,0.06872108456601844,14,9.0,MinMaxScaler,True,COMPLETE
114,0.003352210799635905,2026-06-17 01:58:13.845090,2026-06-17 01:58:14.728583,0 days 00:00:00.883493,0.4183573781327017,20,10.0,MinMaxScaler,True,COMPLETE
115,0.31043658988316114,2026-06-17 01:58:14.729076,2026-06-17 01:58:15.225824,0 days 00:00:00.496748,0.2136221022349194,17,2.0,MinMaxScaler,True,COMPLETE
116,0.013190248173672326,2026-06-17 01:58:15.226415,2026-06-17 01:58:15.903887,0 days 00:00:00.677472,0.30558322356411,18,8.0,MinMaxScaler,True,COMPLETE
117,-0.05488222394334049,2026-06-17 01:58:15.904458,2026-06-17 01:58:16.202468,0 days 00:00:00.298010,0.0523297762171584,12,3.0,MinMaxScaler,True,COMPLETE
118,0.41501526669682265,2026-06-17 01:58:16.202912,2026-06-17 01:58:17.028466,0 days 00:00:00.825554,0.1807569338511416,13,,MinMaxScaler,False,COMPLETE
119,0.0,2026-06-17 01:58:17.028900,2026-06-17 01:58:17.713999,0 days 00:00:00.685099,0.4307555213312947,5,4.0,MinMaxScaler,True,COMPLETE
120,0.0,2026-06-17 01:58:17.714480,2026-06-17 01:58:18.985306,0 days 00:00:01.270826,0.6885656991538833,12,9.0,MinMaxScaler,True,COMPLETE
121,0.3754785599353796,2026-06-17 01:58:18.985855,2026-06-17 01:58:19.572727,0 days 00:00:00.586872,0.2449451067212511,16,9.0,MinMaxScaler,True,COMPLETE
122,0.0,2026-06-17 01:58:19.573161,2026-06-17 01:58:21.812996,0 days 00:00:02.239835,1.95350644380285,7,9.0,MinMaxScaler,True,COMPLETE
123,0.4243068106531747,2026-06-17 01:58:21.814417,2026-06-17 01:58:22.372965,0 days 00:00:00.558548,0.1449239390710685,19,10.0,MinMaxScaler,True,COMPLETE
124,0.008997871056578191,2026-06-17 01:58:22.373468,2026-06-17 01:58:23.043637,0 days 00:00:00.670169,0.34049087093274893,14,8.0,MinMaxScaler,True,COMPLETE
125,0.37755024289853023,2026-06-17 01:58:23.044078,2026-06-17 01:58:23.587363,0 days 00:00:00.543285,0.23194597751649104,16,9.0,MinMaxScaler,True,COMPLETE
126,0.0,2026-06-17 01:58:23.587863,2026-06-17 01:58:24.711015,0 days 00:00:01.123152,0.527720130983821,17,10.0,MinMaxScaler,True,COMPLETE
127,0.3513054159662273,2026-06-17 01:58:24.711430,2026-06-17 01:58:25.082086,0 days 00:00:00.370656,0.1373261318593074,15,2.0,MinMaxScaler,True,COMPLETE
128,0.0,2026-06-17 01:58:25.082548,2026-06-17 01:58:25.665379,0 days 00:00:00.582831,0.0517402495622995,12,9.0,MinMaxScaler,True,COMPLETE
129,0.007170615451594927,2026-06-17 01:58:25.665890,2026-06-17 01:58:26.486933,0 days 00:00:00.821043,0.35068404521422214,11,10.0,MinMaxScaler,True,COMPLETE
130,0.0,2026-06-17 01:58:26.487398,2026-06-17 01:58:27.006829,0 days 00:00:00.519431,0.2559478045681,13,8.0,StandardScaler,True,COMPLETE
131,0.410771545873282,2026-06-17 01:58:27.007281,2026-06-17 01:58:27.493685,0 days 00:00:00.486404,0.1337150205653437,14,7.0,MinMaxScaler,True,COMPLETE
132,0.42004204277325324,2026-06-17 01:58:27.494149,2026-06-17 01:58:28.079760,0 days 00:00:00.585611,0.20523000779247863,13,8.0,MinMaxScaler,True,COMPLETE
133,0.0015865569695760295,2026-06-17 01:58:28.080416,2026-06-17 01:58:28.893012,0 days 00:00:00.812596,0.436097527000735,15,7.0,MinMaxScaler,True,COMPLETE
134,0.0,2026-06-17 01:58:28.893449,2026-06-17 01:58:29.475289,0 days 00:00:00.581840,0.05055706822911407,14,9.0,MinMaxScaler,True,COMPLETE
135,0.012490472010169638,2026-06-17 01:58:29.475730,2026-06-17 01:58:30.100477,0 days 00:00:00.624747,0.3094727190900913,13,7.0,MinMaxScaler,True,COMPLETE
136,0.311025146467643,2026-06-17 01:58:30.101691,2026-06-17 01:58:30.514730,0 days 00:00:00.413039,0.17872051809934164,18,2.0,MinMaxScaler,True,COMPLETE
137,0.0,2026-06-17 01:58:30.515233,2026-06-17 01:58:32.636814,0 days 00:00:02.121581,2.531359699570079,15,5.0,MinMaxScaler,True,COMPLETE
138,0.0,2026-06-17 01:58:32.637279,2026-06-17 01:58:34.021539,0 days 00:00:01.384260,0.5991706517945028,12,,MinMaxScaler,False,COMPLETE
139,0.004244260197950464,2026-06-17 01:58:34.022028,2026-06-17 01:58:34.882666,0 days 00:00:00.860638,0.4064630482409951,16,9.0,MinMaxScaler,True,COMPLETE
140,0.42313319332027205,2026-06-17 01:58:34.883119,2026-06-17 01:58:35.385127,0 days 00:00:00.502008,0.16361510124780426,11,8.0,MinMaxScaler,True,COMPLETE
141,0.3695907974806301,2026-06-17 01:58:35.385977,2026-06-17 01:58:35.882696,0 days 00:00:00.496719,0.24251122488857893,14,6.0,MinMaxScaler,True,COMPLETE
142,0.012082305922718176,2026-06-17 01:58:35.883144,2026-06-17 01:58:36.518499,0 days 00:00:00.635355,0.30715014997627854,15,7.0,MinMaxScaler,True,COMPLETE
143,0.5337779260751444,2026-06-17 01:58:36.518927,2026-06-17 01:58:37.173852,0 days 00:00:00.654925,0.1504652419781257,16,10.0,MinMaxScaler,True,COMPLETE
144,0.3473708957569165,2026-06-17 01:58:37.174333,2026-06-17 01:58:37.771164,0 days 00:00:00.596831,0.13514891237626328,16,10.0,MinMaxScaler,True,COMPLETE
145,0.0,2026-06-17 01:58:37.771681,2026-06-17 01:58:38.787035,0 days 00:00:01.015354,0.5104722208424852,17,10.0,MinMaxScaler,True,COMPLETE
146,0.0,2026-06-17 01:58:38.787448,2026-06-17 01:58:39.350987,0 days 00:00:00.563539,0.05586376332948751,12,10.0,MinMaxScaler,True,COMPLETE
147,0.008168653679398515,2026-06-17 01:58:39.351402,2026-06-17 01:58:40.135938,0 days 00:00:00.784536,0.346047277188978,13,10.0,MinMaxScaler,True,COMPLETE
